{
   "$comment": "Generated from quality.yaml by `uv run dd-gen-schema <path to quality.yaml>`. Do not edit.",
   "$id": "https://w3id.org/data-director/agents/quality/MetadataRecord",
   "$schema": "http://json-schema.org/draft-07/schema#",
   "additionalProperties": false,
   "description": "An existing metadata record about a dataset, as a repository or catalogue holds it. The input a quality or validation agent assesses. Slots are the DCAT and Dublin Core terms a minimal record carries; TODO(#22): widen when a real repository export is exercised.",
   "properties": {
      "schema_class": {
         "description": "Type designator: the name of the class this object is an instance of. Discriminates the input and payload unions, and lets a consumer name a payload class it does not recognise.",
         "enum": [
            "MetadataRecord"
         ],
         "type": "string"
      },
      "identifier": {
         "description": "The record's own identifier, e.g. a DOI or a catalogue URI.",
         "type": [
            "string",
            "null"
         ]
      },
      "title": {
         "type": [
            "string",
            "null"
         ]
      },
      "description": {
         "type": [
            "string",
            "null"
         ]
      },
      "licence": {
         "description": "The licence the record declares, as an IRI or SPDX identifier.",
         "type": [
            "string",
            "null"
         ]
      },
      "creators": {
         "items": {
            "type": "string"
         },
         "type": [
            "array",
            "null"
         ]
      },
      "keywords": {
         "items": {
            "type": "string"
         },
         "type": [
            "array",
            "null"
         ]
      }
   },
   "required": [
      "schema_class"
   ],
   "title": "MetadataRecord",
   "type": "object"
}
